PMID,Title,Authors,Citation,First Author,Journal/Book,Publication Year,Create Date,PMCID,NIHMS ID,DOI
"26967930","Review and comparison of methodologies for indirect comparison of clinical trial results: an illustration with ranibizumab and aflibercept","Regnier SA, Alsop J, Wright J, Nixon R, Staines H, Fajnkuchen F.","Expert Rev Pharmacoecon Outcomes Res. 2016 Dec;16(6):793-801. doi: 10.1586/14737167.2016.1165609. Epub 2016 Mar 25.","Regnier SA","Expert Rev Pharmacoecon Outcomes Res","2016","2016/03/12","","","10.1586/14737167.2016.1165609"
"26949899","Meta-analysis and adjusted indirect comparison of direct oral anticoagulants in prevention of acute limb ischemia in patients with atrial fibrillation","De Haro J, Bleda S, Varela C, Cañibano C, Acin F.","Curr Med Res Opin. 2016 Jun;32(6):1167-73. doi: 10.1185/03007995.2016.1163256. Epub 2016 Apr 7.","De Haro J","Curr Med Res Opin","2016","2016/03/08","","","10.1185/03007995.2016.1163256"
"26933827","Integrated sensor-augmented pump therapy systems [the MiniMed® Paradigm™ Veo system and the Vibe™ and G4® PLATINUM CGM (continuous glucose monitoring) system] for managing blood glucose levels in type 1 diabetes: a systematic review and economic evaluation","Riemsma R, Corro Ramos I, Birnie R, Büyükkaramikli N, Armstrong N, Ryder S, Duffy S, Worthy G, Al M, Severens J, Kleijnen J.","Health Technol Assess. 2016 Feb;20(17):v-xxxi, 1-251. doi: 10.3310/hta20170.","Riemsma R","Health Technol Assess","2016","2016/03/03","PMC4809467","","10.3310/hta20170"
"26908514","Comparative assessment of onabotulinumtoxinA and mirabegron for overactive bladder: an indirect treatment comparison","Freemantle N, Ginsberg DA, McCool R, Fleetwood K, Arber M, Khalaf K, Loveman C, Ni Q, Glanville J.","BMJ Open. 2016 Feb 23;6(2):e009122. doi: 10.1136/bmjopen-2015-009122.","Freemantle N","BMJ Open","2016","2016/02/25","PMC4769403","","10.1136/bmjopen-2015-009122"
"26907083","Indirect treatment comparison of belatacept versus tacrolimus from a systematic review of immunosuppressive therapies for kidney transplant patients","Muduma G, Hart WM, Patel S, Odeyemi AO.","Curr Med Res Opin. 2016 Jun;32(6):1065-72. doi: 10.1185/03007995.2016.1157463. Epub 2016 Mar 30.","Muduma G","Curr Med Res Opin","2016","2016/02/25","","","10.1185/03007995.2016.1157463"
"26886011","First-line therapy for treatment-naive patients with advanced/metastatic renal cell carcinoma: a systematic review of published randomized controlled trials","Takyar S, Diaz J, Sehgal M, Sapunar F, Pandha H.","Anticancer Drugs. 2016 Jun;27(5):383-97. doi: 10.1097/CAD.0000000000000335.","Takyar S","Anticancer Drugs","2016","2016/02/18","","","10.1097/CAD.0000000000000335"
"26883661","Efficacy and Safety of Aclidinium/Formoterol versus Tiotropium in COPD: Results of an Indirect Treatment Comparison","Medic G, Lindner L, van der Weijden M, Karabis A.","Adv Ther. 2016 Mar;33(3):379-99. doi: 10.1007/s12325-016-0299-4. Epub 2016 Feb 16.","Medic G","Adv Ther","2016","2016/02/18","PMC4833795","","10.1007/s12325-016-0299-4"
"26841367","Testing moderation in network meta-analysis with individual participant data","Dagne GA, Brown CH, Howe G, Kellam SG, Liu L.","Stat Med. 2016 Jul 10;35(15):2485-502. doi: 10.1002/sim.6883. Epub 2016 Feb 2.","Dagne GA","Stat Med","2016","2016/02/04","PMC4893003","NIHMS750384","10.1002/sim.6883"
"26839044","Daclatasvir and Sofosbuvir Versus Sofosbuvir and Ribavirin in Patients with Chronic Hepatitis C Coinfected with HIV: A Matching-adjusted Indirect Comparison","Swallow E, Song J, Yuan Y, Kalsekar A, Kelley C, Peeples M, Mu F, Ackerman P, Signorovitch J.","Clin Ther. 2016 Feb;38(2):404-12. doi: 10.1016/j.clinthera.2015.12.017. Epub 2016 Feb 3.","Swallow E","Clin Ther","2016","2016/02/04","","","10.1016/j.clinthera.2015.12.017"
"26836914","Drug Treatment of Idiopathic Pulmonary Fibrosis: Systematic Review and Network Meta-Analysis","Canestaro WJ, Forrester SH, Raghu G, Ho L, Devine BE.","Chest. 2016 Mar;149(3):756-66. doi: 10.1016/j.chest.2015.11.013. Epub 2016 Jan 13.","Canestaro WJ","Chest","2016","2016/02/03","","","10.1016/j.chest.2015.11.013"
"26824145","Parameterization of a disease progression simulation model for sequentially treated metastatic human epidermal growth factor receptor 2 positive breast cancer patients","Diaby V, Ali AA, Adunlin G, Kohn CG, Montero AJ.","Curr Med Res Opin. 2016 Jun;32(6):991-6. doi: 10.1185/03007995.2016.1149056. Epub 2016 Mar 2.","Diaby V","Curr Med Res Opin","2016","2016/01/30","PMC4959115","NIHMS804456","10.1185/03007995.2016.1149056"
"26804561","Efficacy of two noninvasive weaning strategies in intubated patients with chronic obstructive pulmonary disease: A meta-analysis and indirect treatment comparison","Li PJ, Wang T, Xiao J, Jiang FM, Luo J, Shi CL, Liu GJ, Liang ZA.","Heart Lung. 2016 Mar-Apr;45(2):132-9. doi: 10.1016/j.hrtlng.2015.12.008. Epub 2016 Jan 21.","Li PJ","Heart Lung","2016","2016/01/26","","","10.1016/j.hrtlng.2015.12.008"
"26793987","Daclatasvir + asunaprevir versus sofosbuvir/ledipasvir for hepatitis C genotype 1 in Japanese patients: an indirect comparison","Swallow E, Kelley C, Signorovitch J, Wygant G, McPhee F.","J Comp Eff Res. 2016 May;5(3):273-9. doi: 10.2217/cer.15.69. Epub 2016 Jan 21.","Swallow E","J Comp Eff Res","2016","2016/01/23","","","10.2217/cer.15.69"
"26780905","Lipophilic Statin Versus Rosuvastatin (Hydrophilic) Treatment for Heart Failure: a Meta-Analysis and Adjusted Indirect Comparison of Randomised Trials","Bonsu KO, Reidpath DD, Kadirvelu A.","Cardiovasc Drugs Ther. 2016 Apr;30(2):177-88. doi: 10.1007/s10557-015-6636-z.","Bonsu KO","Cardiovasc Drugs Ther","2016","2016/01/20","","","10.1007/s10557-015-6636-z"
"26769792","Comparative safety and effectiveness of cognitive enhancers for Alzheimer's dementia: protocol for a systematic review and individual patient data network meta-analysis","Veroniki AA, Straus SE, Ashoor HM, Hamid JS, Hemmelgarn BR, Holroyd-Leduc J, Majumdar SR, McAuley G, Tricco AC.","BMJ Open. 2016 Jan 13;6(1):e010251. doi: 10.1136/bmjopen-2015-010251.","Veroniki AA","BMJ Open","2016","2016/01/16","PMC4735316","","10.1136/bmjopen-2015-010251"
"26754852","GetReal in network meta-analysis: a review of the methodology","Efthimiou O, Debray TP, van Valkenhoef G, Trelle S, Panayidou K, Moons KG, Reitsma JB, Shang A, Salanti G; GetReal Methods Review Group.","Res Synth Methods. 2016 Sep;7(3):236-63. doi: 10.1002/jrsm.1195. Epub 2016 Jan 11.","Efthimiou O","Res Synth Methods","2016","2016/01/13","","","10.1002/jrsm.1195"
"26733020","Meta-analysis supporting noninferiority of oxaliplatin plus S-1 to cisplatin plus S-1 in first-line treatment of advanced gastric cancer (G-SOX study): indirect comparison with S-1 alone","Hamada C, Yamada Y, Azuma M, Nishikawa K, Gotoh M, Bando H, Sugimoto N, Nishina T, Amagai K, Chin K, Niwa Y, Tsuji A, Imamura H, Tsuda M, Yasui H, Fujii H, Yamaguchi K, Yasui H, Hironaka S, Shimada K, Miwa H, Hyodo I.","Int J Clin Oncol. 2016 Aug;21(4):668-675. doi: 10.1007/s10147-015-0938-9. Epub 2016 Jan 5.","Hamada C","Int J Clin Oncol","2016","2016/01/07","","","10.1007/s10147-015-0938-9"
"26729046","Once-daily liraglutide (1.2 mg) compared with twice-daily exenatide (10 μg) in the treatment of type 2 diabetes patients: An indirect treatment comparison meta-analysis","Twigg SM, Daja MM, O'leary BA, Adena MA.","J Diabetes. 2016 Nov;8(6):866-876. doi: 10.1111/1753-0407.12372. Epub 2016 Apr 4.","Twigg SM","J Diabetes","2016","2016/01/06","","","10.1111/1753-0407.12372"
"26719325","Safety and effectiveness of long-acting versus intermediate-acting insulin for patients with type 1 diabetes: protocol for a systematic review and individual patient data network meta-analysis","Veroniki AA, Straus SE, Ashoor HM, Hamid JS, Yu C, Tricco AC.","BMJ Open. 2015 Dec 30;5(12):e010160. doi: 10.1136/bmjopen-2015-010160.","Veroniki AA","BMJ Open","2015","2016/01/01","PMC4710824","","10.1136/bmjopen-2015-010160"
"26671239","First-line therapy for non-transplant eligible patients with multiple myeloma: direct and adjusted indirect comparison of treatment regimens on the existing market in Germany","Kuhr K, Wirth D, Srivastava K, Lehmacher W, Hellmich M.","Eur J Clin Pharmacol. 2016 Mar;72(3):257-65. doi: 10.1007/s00228-015-1998-5. Epub 2015 Dec 16.","Kuhr K","Eur J Clin Pharmacol","2016","2015/12/17","","","10.1007/s00228-015-1998-5"
"26637048","Efficacy and tolerability of switching therapy to vortioxetine versus other antidepressants in patients with major depressive disorder","Brignone M, Diamand F, Painchault C, Takyar S.","Curr Med Res Opin. 2016;32(2):351-66. doi: 10.1185/03007995.2015.1128404.","Brignone M","Curr Med Res Opin","2016","2015/12/05","","","10.1185/03007995.2015.1128404"
"26602976","An Indirect Comparison of Everolimus Versus Axitinib in US Patients With Advanced Renal Cell Carcinoma in Whom Prior Sunitinib Therapy Failed","Sherman S, Amzal B, Calvo E, Wang X, Park J, Liu Z, Lin C, Casciano R.","Clin Ther. 2015 Oct 22:S0149-2918(15)01144-3. doi: 10.1016/j.clinthera.2015.09.013. Online ahead of print.","Sherman S","Clin Ther","2015","2015/11/26","","","10.1016/j.clinthera.2015.09.013"
"26586608","A small n sequential multiple assignment randomized trial design for use in rare disease research","Tamura RN, Krischer JP, Pagnoux C, Micheletti R, Grayson PC, Chen YF, Merkel PA.","Contemp Clin Trials. 2016 Jan;46:48-51. doi: 10.1016/j.cct.2015.11.010. Epub 2015 Nov 14.","Tamura RN","Contemp Clin Trials","2016","2015/11/21","PMC4695231","NIHMS740778","10.1016/j.cct.2015.11.010"
"26495961","Trial-based cost-effectiveness of abatacept for rheumatoid arthritis patients in Italy","Gaultney J, Benucci M, Iannazzo S, Nappi C, Sion K, Sabater FJ.","Expert Rev Pharmacoecon Outcomes Res. 2016 Jun;16(3):409-17. doi: 10.1586/14737167.2016.1102636. Epub 2015 Oct 23.","Gaultney J","Expert Rev Pharmacoecon Outcomes Res","2016","2015/10/27","","","10.1586/14737167.2016.1102636"
"26477648","Cost-effectiveness of Apixaban Compared With Edoxaban for Stroke Prevention in Nonvalvular Atrial Fibrillation","Lip GY, Lanitis T, Kongnakorn T, Phatak H, Chalkiadaki C, Liu X, Kuznik A, Lawrence J, Dorian P.","Clin Ther. 2015 Nov 1;37(11):2476-2488.e27. doi: 10.1016/j.clinthera.2015.09.005. Epub 2015 Oct 23.","Lip GY","Clin Ther","2015","2015/10/20","","","10.1016/j.clinthera.2015.09.005"
"26455472","Indirect comparison of the antiviral efficacy of peginterferon alpha 2a plus ribavirin used with or without simeprevir in genotype 4 hepatitis C virus infection, where common comparator study arms are lacking: a special application of the matching adjusted indirect comparison methodology","Van Sanden S, Pisini M, Duchesne I, Mehnert A, Belsey J.","Curr Med Res Opin. 2016;32(1):147-54. doi: 10.1185/03007995.2015.1106934. Epub 2015 Oct 29.","Van Sanden S","Curr Med Res Opin","2016","2015/10/13","","","10.1185/03007995.2015.1106934"
"29144701","Vortioxetine (Addendum to Commission A15-16)","Institute for Quality and Efficiency in Health Care.","Cologne, Germany: Institute for Quality and Efficiency in Health Care (IQWiG); 2015 Sep 24. Extract of Dossier Assessment No. A15-37.","Institute for Quality and Efficiency in Health Care","Vortioxetine (Addendum to Commission A15-16)","2015","2015/09/24","","",""
"26390233","Daclatasvir + sofosbuvir versus standard of care for hepatitis C genotype 3: a matching-adjusted indirect comparison","Swallow E, Song J, Yuan Y, Kalsekar A, Kelley C, Mu F, Kim S, Noviello S, Signorovitch J.","J Comp Eff Res. 2016 Mar;5(2):129-39. doi: 10.2217/cer.15.49. Epub 2015 Sep 21.","Swallow E","J Comp Eff Res","2016","2015/09/22","","","10.2217/cer.15.49"
"26382309","Comparative efficacy and safety of estradiol transdermal preparations for the treatment of vasomotor symptoms in postmenopausal women: an indirect comparison meta-analysis","Derzko C, Sergerie M, Siliman G, Alberton M, Thorlund K.","Menopause. 2016 Mar;23(3):294-303. doi: 10.1097/GME.0000000000000552.","Derzko C","Menopause","2016","2015/09/19","","","10.1097/GME.0000000000000552"
"26363775","New methods for treatment effect calibration, with applications to non-inferiority trials","Zhang Z, Nie L, Soon G, Hu Z.","Biometrics. 2016 Mar;72(1):20-9. doi: 10.1111/biom.12388. Epub 2015 Sep 13.","Zhang Z","Biometrics","2016","2015/09/14","","","10.1111/biom.12388"
"26355679","Efficacy of Supplementation with B Vitamins for Stroke Prevention: A Network Meta-Analysis of Randomized Controlled Trials","Dong H, Pi F, Ding Z, Chen W, Pang S, Dong W, Zhang Q.","PLoS One. 2015 Sep 10;10(9):e0137533. doi: 10.1371/journal.pone.0137533. eCollection 2015.","Dong H","PLoS One","2015","2015/09/11","PMC4565665","","10.1371/journal.pone.0137533"
"26352650","Comparative efficacy of antiviral therapy in preventing vertical transmission of hepatitis B: a network meta-analysis","Njei B, Gupta N, Ewelukwa O, Ditah I, Foma M, Lim JK.","Liver Int. 2016 May;36(5):634-41. doi: 10.1111/liv.12959. Epub 2015 Oct 1.","Njei B","Liver Int","2016","2015/09/10","PMC4824664","NIHMS773241","10.1111/liv.12959"
"26346974","Meta-analysis of postoperative adjuvant chemotherapy without radiotherapy in early stage non-small cell lung cancer","Chen YY, Wang LW, Wang SY, Wu BB, Wang ZM, Chen FF, Xiong B.","Onco Targets Ther. 2015 Aug 4;8:2033-43. doi: 10.2147/OTT.S88700. eCollection 2015.","Chen YY","Onco Targets Ther","2015","2015/09/09","PMC4531011","","10.2147/OTT.S88700"
"26331530","Adjuvant antiviral therapy for hepatitis B virus-related hepatocellular carcinoma after curative treatment: A systematic review and meta-analysis","Liu GM, Huang XY, Shen SL, Hu WJ, Peng BG.","Hepatol Res. 2016 Jan;46(1):100-10. doi: 10.1111/hepr.12584. Epub 2015 Oct 6.","Liu GM","Hepatol Res","2016","2015/09/03","","","10.1111/hepr.12584"
"26320127","Randomized controlled trials in relapsed/refractory follicular lymphoma: a systematic review and meta-analysis","Police RL, Trask PC, Wang J, Olivares R, Khan S, Abbe A, Colosia A, Njue A, Sherril B, Ruiz-Soto R, Kaye JA, Hamadani M.","J Oncol Pharm Pract. 2016 Oct;22(5):666-78. doi: 10.1177/1078155215603230. Epub 2015 Aug 28.","Police RL","J Oncol Pharm Pract","2016","2015/08/31","","","10.1177/1078155215603230"
"26297097","When Does FDAMA Section 114 Apply? Ten Case Studies","Neumann PJ, Saret CJ.","Value Health. 2015 Jul;18(5):682-9. doi: 10.1016/j.jval.2015.02.013. Epub 2015 Apr 16.","Neumann PJ","Value Health","2015","2015/08/23","","","10.1016/j.jval.2015.02.013"
"26293745","A Common Reference-Based Indirect Comparison Meta-Analysis of Buccal versus Intranasal Midazolam for Early Status Epilepticus","Brigo F, Nardone R, Tezzon F, Trinka E.","CNS Drugs. 2015 Sep;29(9):741-57. doi: 10.1007/s40263-015-0271-x.","Brigo F","CNS Drugs","2015","2015/08/22","","","10.1007/s40263-015-0271-x"
"26287812","Get real in individual participant data (IPD) meta-analysis: a review of the methodology","Debray TP, Moons KG, van Valkenhoef G, Efthimiou O, Hummel N, Groenwold RH, Reitsma JB; GetReal Methods Review Group.","Res Synth Methods. 2015 Dec;6(4):293-309. doi: 10.1002/jrsm.1160. Epub 2015 Aug 19.","Debray TP","Res Synth Methods","2015","2015/08/20","PMC5042043","","10.1002/jrsm.1160"
"26280110","Effects of Statin Treatment on Inflammation and Cardiac Function in Heart Failure: An Adjusted Indirect Comparison Meta-Analysis of Randomized Trials","Bonsu KO, Reidpath DD, Kadirvelu A.","Cardiovasc Ther. 2015 Dec;33(6):338-46. doi: 10.1111/1755-5922.12150.","Bonsu KO","Cardiovasc Ther","2015","2015/08/18","","","10.1111/1755-5922.12150"
"26189925","Comparative effectiveness of pharmacological interventions for nonalcoholic steatohepatitis: A systematic review and network meta-analysis","Singh S, Khera R, Allen AM, Murad MH, Loomba R.","Hepatology. 2015 Nov;62(5):1417-32. doi: 10.1002/hep.27999. Epub 2015 Oct 1.","Singh S","Hepatology","2015","2015/07/21","","","10.1002/hep.27999"
"26159375","Comparative efficacy and safety of daclatasvir/asunaprevir versus IFN-based regimens in genotype 1b hepatitis C virus infection","Signorovitch JE, Betts KA, Song Y, Sorg RA, Li J, Behl AS, Kalsekar A.","J Comp Eff Res. 2015 Nov;4(6):593-605. doi: 10.2217/cer.15.33. Epub 2015 Jul 10.","Signorovitch JE","J Comp Eff Res","2015","2015/07/11","","","10.2217/cer.15.33"
"26124700","Cost-utility analysis of certolizumab pegol versus alternative tumour necrosis factor inhibitors available for the treatment of moderate-to-severe active rheumatoid arthritis in Spain","Hidalgo-Vega Á, Villoro R, Blasco JA, Talavera P, Ferro B, Purcaru O.","Cost Eff Resour Alloc. 2015 Jun 9;13:11. doi: 10.1186/s12962-015-0037-9. eCollection 2015.","Hidalgo-Vega Á","Cost Eff Resour Alloc","2015","2015/07/01","PMC4484891","","10.1186/s12962-015-0037-9"
"29144655","Dulaglutide (Addendum to Commission A15-07)","Institute for Quality and Efficiency in Health Care.","Cologne, Germany: Institute for Quality and Efficiency in Health Care (IQWiG); 2015 Jun 25. Extract of Dossier Assessment No. A15-22.","Institute for Quality and Efficiency in Health Care","Dulaglutide (Addendum to Commission A15-07)","2015","2015/06/25","","",""
"28609085","Dasabuvir and Ombitasvir / Paritaprevir / Ritonavir (Addendum to Commissions A15-03 and A15-04)","Institute for Quality and Efficiency in Health Care.","Cologne, Germany: Institute for Quality and Efficiency in Health Care (IQWiG); 2015 Jun 25. Extract of Dossier Assessment No. A15-21.","Institute for Quality and Efficiency in Health Care","Dasabuvir and Ombitasvir / Paritaprevir / Ritonavir (Addendum to Commissions A15-03 and A15-04)","2015","2015/06/25","","",""
"26105964","Influence of point estimates and study power of bioequivalence studies on establishing bioequivalence between generics by adjusted indirect comparisons","Gwaza L, Gordon J, Potthast H, Welink J, Leufkens H, Stahl M, García-Arieta A.","Eur J Clin Pharmacol. 2015 Sep;71(9):1083-9. doi: 10.1007/s00228-015-1889-9. Epub 2015 Jun 24.","Gwaza L","Eur J Clin Pharmacol","2015","2015/06/25","","","10.1007/s00228-015-1889-9"
"26099484","Multivariate meta-analysis using individual participant data","Riley RD, Price MJ, Jackson D, Wardle M, Gueyffier F, Wang J, Staessen JA, White IR.","Res Synth Methods. 2015 Jun;6(2):157-74. doi: 10.1002/jrsm.1129. Epub 2014 Nov 21.","Riley RD","Res Synth Methods","2015","2015/06/24","PMC4847645","EMS67641","10.1002/jrsm.1129"
"26091937","Comparative Effectiveness of Pharmacological Interventions for Severe Alcoholic Hepatitis: A Systematic Review and Network Meta-analysis","Singh S, Murad MH, Chandar AK, Bongiorno CM, Singal AK, Atkinson SR, Thursz MR, Loomba R, Shah VH.","Gastroenterology. 2015 Oct;149(4):958-70.e12. doi: 10.1053/j.gastro.2015.06.006. Epub 2015 Jun 16.","Singh S","Gastroenterology","2015","2015/06/21","","","10.1053/j.gastro.2015.06.006"
"26062932","Investigation into the interchangeability of generic formulations using immunosuppressants and a broad selection of medicines","Yu Y, Teerenstra S, Neef C, Burger D, Maliepaard M.","Eur J Clin Pharmacol. 2015 Aug;71(8):979-90. doi: 10.1007/s00228-015-1878-z. Epub 2015 Jun 12.","Yu Y","Eur J Clin Pharmacol","2015","2015/06/12","PMC4500859","","10.1007/s00228-015-1878-z"
"25985265","Cost-effectiveness of lurasidone vs quetiapine extended-release (XR) in patients with bipolar depression","Rajagopalan K, Meyer K, O'Day K, Denno M, Loebel A.","J Med Econ. 2015;18(10):821-7. doi: 10.3111/13696998.2015.1052462. Epub 2015 Jul 27.","Rajagopalan K","J Med Econ","2015","2015/05/19","","","10.3111/13696998.2015.1052462"
"25961824","Comparison of glucose lowering effect of metformin and acarbose in type 2 diabetes mellitus: a meta-analysis","Gu S, Shi J, Tang Z, Sawhney M, Hu H, Shi L, Fonseca V, Dong H.","PLoS One. 2015 May 11;10(5):e0126704. doi: 10.1371/journal.pone.0126704. eCollection 2015.","Gu S","PLoS One","2015","2015/05/12","PMC4427275","","10.1371/journal.pone.0126704"
"25926144","Methods and characteristics of published network meta-analyses using individual patient data: protocol for a scoping review","Veroniki AA, Soobiah C, Tricco AC, Elliott MJ, Straus SE.","BMJ Open. 2015 Apr 29;5(4):e007103. doi: 10.1136/bmjopen-2014-007103.","Veroniki AA","BMJ Open","2015","2015/05/01","PMC4420933","","10.1136/bmjopen-2014-007103"
"25924975","Incorporation of individual-patient data in network meta-analysis for multiple continuous endpoints, with application to diabetes treatment","Hong H, Fu H, Price KL, Carlin BP.","Stat Med. 2015 Sep 10;34(20):2794-819. doi: 10.1002/sim.6519. Epub 2015 Apr 30.","Hong H","Stat Med","2015","2015/05/01","","","10.1002/sim.6519"
"25906420","Dabrafenib for Treating Unresectable, Advanced or Metastatic BRAF V600 Mutation-Positive Melanoma: An Evidence Review Group Perspective","Fleeman N, Bagust A, Beale S, Boland A, Dickson R, Dwan K, Richardson M, Dundar Y, Davis H, Banks L.","Pharmacoeconomics. 2015 Sep;33(9):893-904. doi: 10.1007/s40273-015-0276-9.","Fleeman N","Pharmacoeconomics","2015","2015/04/24","","","10.1007/s40273-015-0276-9"
"25887646","Network meta-analysis combining individual patient and aggregate data from a mixture of study designs with an application to pulmonary arterial hypertension","Thom HH, Capkun G, Cerulli A, Nixon RM, Howard LS.","BMC Med Res Methodol. 2015 Apr 12;15:34. doi: 10.1186/s12874-015-0007-0.","Thom HH","BMC Med Res Methodol","2015","2015/04/19","PMC4403724","","10.1186/s12874-015-0007-0"
"25817087","Indirect comparison for Anti-TNF drugs in moderate to severe ulcerative colitis","Galván-Banqueri M, Vega-Coca MD, Castillo-Muñoz MA, Beltrán Calvo C, Molina López T.","Farm Hosp. 2015 Mar 1;39(2):80-91. doi: 10.7399/fh.2015.39.2.8218.","Galván-Banqueri M","Farm Hosp","2015","2015/03/31","","","10.7399/fh.2015.39.2.8218"
"25795232","Simulation and matching-based approaches for indirect comparison of treatments","Ishak KJ, Proskorovsky I, Benedict A.","Pharmacoeconomics. 2015 Jun;33(6):537-49. doi: 10.1007/s40273-015-0271-1.","Ishak KJ","Pharmacoeconomics","2015","2015/03/22","","","10.1007/s40273-015-0271-1"
"25773559","Critical appraisal of network meta-analyses evaluating the efficacy and safety of new oral anticoagulants in atrial fibrillation stroke prevention trials","Cope S, Clemens A, Hammès F, Noack H, Jansen JP.","Value Health. 2015 Mar;18(2):234-49. doi: 10.1016/j.jval.2014.10.012. Epub 2015 Jan 28.","Cope S","Value Health","2015","2015/03/17","","","10.1016/j.jval.2014.10.012"
"25624763","Efficacy comparison of duloxetine and SSRIs at doses approved in Japan","Harada E, Schacht A, Koyama T, Marangell LB, Tsuji T, Escobar R.","Neuropsychiatr Dis Treat. 2015 Jan 12;11:115-23. doi: 10.2147/NDT.S72642. eCollection 2015.","Harada E","Neuropsychiatr Dis Treat","2015","2015/01/28","PMC4296960","","10.2147/NDT.S72642"
"25585376","Network meta-analysis for evidence synthesis: what is it and why is it posed to dominate cardiovascular decision making?","Biondi-Zoccai G, Abbate A, Benedetto U, Palmerini T, D'Ascenzo F, Frati G.","Int J Cardiol. 2015 Mar 1;182:309-14. doi: 10.1016/j.ijcard.2015.01.023. Epub 2015 Jan 7.","Biondi-Zoccai G","Int J Cardiol","2015","2015/01/14","","","10.1016/j.ijcard.2015.01.023"
"25565891","Incorporating alternative design clinical trials in network meta-analyses","Thorlund K, Druyts E, Toor K, Jansen JP, Mills EJ.","Clin Epidemiol. 2014 Dec 23;7:29-35. doi: 10.2147/CLEP.S70853. eCollection 2015.","Thorlund K","Clin Epidemiol","2014","2015/01/08","PMC4278731","","10.2147/CLEP.S70853"
"25559771","Relative efficacy and safety of simeprevir and telaprevir in treatment-naïve hepatitis C-infected patients in a Japanese population: A Bayesian network meta-analysis","Quigley JM, Bryden PA, Scott DA, Kuwabara H, Cerri K.","Hepatol Res. 2015 Oct;45(10):E89-98. doi: 10.1111/hepr.12467. Epub 2015 Mar 3.","Quigley JM","Hepatol Res","2015","2015/01/07","","","10.1111/hepr.12467"
"25555272","Safety of short-term dual antiplatelet therapy after drug-eluting stents: An updated meta-analysis with direct and adjusted indirect comparison of randomized control trials","Bulluck H, Kwok CS, Ryding AD, Loke YK.","Int J Cardiol. 2015 Feb 15;181:331-9. doi: 10.1016/j.ijcard.2014.12.037. Epub 2014 Dec 13.","Bulluck H","Int J Cardiol","2015","2015/01/03","","","10.1016/j.ijcard.2014.12.037"
"26962372","Failure Rate of Direct High-Viscosity Glass-Ionomer Versus Hybrid Resin Composite Restorations in Posterior Permanent Teeth - a Systematic Review","Mickenautsch S, Yengopal V.","Open Dent J. 2015 Dec 22;9:438-48. doi: 10.2174/1874210601509010438. eCollection 2015.","Mickenautsch S","Open Dent J","2015","2016/03/11","PMC4768657","","10.2174/1874210601509010438"
"25534216","The efficacy and safety of different anticoagulants on patients with severe sepsis and derangement of coagulation: a protocol for network meta-analysis of randomised controlled trials","Jiang L, Jiang S, Feng X, Ma Y, Zhang M.","BMJ Open. 2014 Dec 22;4(12):e006770. doi: 10.1136/bmjopen-2014-006770.","Jiang L","BMJ Open","2014","2014/12/24","PMC4275679","","10.1136/bmjopen-2014-006770"
"25533141","Comparative efficiency research (COMER): meta-analysis of cost-effectiveness studies","Crespo C, Monleon A, Díaz W, Ríos M.","BMC Med Res Methodol. 2014 Dec 22;14:139. doi: 10.1186/1471-2288-14-139.","Crespo C","BMC Med Res Methodol","2014","2014/12/24","PMC4292992","","10.1186/1471-2288-14-139"
"25530283","Overview review: Comparative efficacy of oral ibuprofen and paracetamol (acetaminophen) across acute and chronic pain conditions","Moore RA, Derry S, Wiffen PJ, Straube S, Aldington DJ.","Eur J Pain. 2015 Oct;19(9):1213-23. doi: 10.1002/ejp.649. Epub 2014 Dec 22.","Moore RA","Eur J Pain","2015","2014/12/23","","","10.1002/ejp.649"
