PMID,Title,Authors,Citation,First Author,Journal/Book,Publication Year,Create Date,PMCID,NIHMS ID,DOI
"30617044","Comparison of mHealth and Face-to-Face Interventions for Smoking Cessation Among People Living With HIV: Meta-Analysis","Uthman OA, Nduka CU, Abba M, Enriquez R, Nordenstedt H, Nalugoda F, Kengne AP, Ekström AM.","JMIR Mhealth Uhealth. 2019 Jan 7;7(1):e203. doi: 10.2196/mhealth.9329.","Uthman OA","JMIR Mhealth Uhealth","2019","2019/01/09","PMC6329415","","10.2196/mhealth.9329"
"30612667","Indirect treatment comparisons and biologics","Mauger D, Apter AJ.","J Allergy Clin Immunol. 2019 Jan;143(1):84-86. doi: 10.1016/j.jaci.2018.11.005.","Mauger D","J Allergy Clin Immunol","2019","2019/01/08","","","10.1016/j.jaci.2018.11.005"
"30610657","Modeling Covariate-Adjusted Survival for Economic Evaluations in Oncology","Majer IM, Castaigne JG, Palmer S, DeCosta L, Campioni M.","Pharmacoeconomics. 2019 May;37(5):727-737. doi: 10.1007/s40273-018-0759-6.","Majer IM","Pharmacoeconomics","2019","2019/01/06","","","10.1007/s40273-018-0759-6"
"30598174","Indirect Treatment Comparisons and Biologics","Mauger D, Apter AJ.","J Allergy Clin Immunol Pract. 2019 Jan;7(1):131-133. doi: 10.1016/j.jaip.2018.11.008.","Mauger D","J Allergy Clin Immunol Pract","2019","2019/01/02","","","10.1016/j.jaip.2018.11.008"
"30595674","Allowing for informative missingness in aggregate data meta-analysis with continuous or binary outcomes: Extensions to metamiss","Chaimani A, Mavridis D, Higgins JPT, Salanti G, White IR.","Stata J. 2018 Jul 1;18(3):716-740.","Chaimani A","Stata J","2018","2019/01/01","PMC6309174","EMS79895",""
"30591022","An efficacy comparison of anti-vascular growth factor agents and laser photocoagulation in diabetic macular edema: a network meta-analysis incorporating individual patient-level data","Muston D, Korobelnik JF, Reason T, Hawkins N, Chatzitheofilou I, Ryan F, Kaiser PK.","BMC Ophthalmol. 2018 Dec 27;18(1):340. doi: 10.1186/s12886-018-1006-9.","Muston D","BMC Ophthalmol","2018","2018/12/29","PMC6307247","","10.1186/s12886-018-1006-9"
"30588048","The number needed to treat and relevant between-trial comparisons of competing interventions","Jansen JP, Khalid JM, Smyth MD, Patel H.","Clinicoecon Outcomes Res. 2018 Dec 14;10:865-871. doi: 10.2147/CEOR.S180491. eCollection 2018.","Jansen JP","Clinicoecon Outcomes Res","2018","2018/12/28","PMC6298880","","10.2147/CEOR.S180491"
"30567533","Axitinib, cabozantinib, or everolimus in the treatment of prior sunitinib-treated patients with metastatic renal cell carcinoma: results of matching-adjusted indirect comparison analyses","Proskorovsky I, Benedict A, Negrier S, Bargo D, Sandin R, Ramaswamy K, Desai J, Cappelleri JC, Larkin J.","BMC Cancer. 2018 Dec 19;18(1):1271. doi: 10.1186/s12885-018-5157-0.","Proskorovsky I","BMC Cancer","2018","2018/12/21","PMC6300002","","10.1186/s12885-018-5157-0"
"30563395","Clinical and economic outcomes associated with treatment sequences in patients with BRAF-mutant advanced melanoma","Tarhini A, McDermott D, Ambavane A, Gupte-Singh K, Aponte-Ribero V, Ritchings C, Benedict A, Rao S, Regan MM, Atkins M.","Immunotherapy. 2019 Mar;11(4):283-295. doi: 10.2217/imt-2018-0168. Epub 2018 Dec 19.","Tarhini A","Immunotherapy","2019","2018/12/20","","","10.2217/imt-2018-0168"
"30547369","Pembrolizumab for Locally Advanced or Metastatic Urothelial Cancer Where Cisplatin is Unsuitable: An Evidence Review Group Perspective of a NICE Single Technology Appraisal","Ren S, Squires H, Hock E, Kaltenthaler E, Rawdin A, Alifrangis C.","Pharmacoeconomics. 2019 Sep;37(9):1073-1080. doi: 10.1007/s40273-018-0750-2.","Ren S","Pharmacoeconomics","2019","2018/12/15","","","10.1007/s40273-018-0750-2"
"30532569","Cost-effectiveness analysis of ribociclib versus palbociclib in the first-line treatment of HR+/HER2- advanced or metastatic breast cancer in Spain","Galve-Calvo E, González-Haba E, Gostkorzewicz J, Martínez I, Pérez-Mitru A.","Clinicoecon Outcomes Res. 2018 Nov 14;10:773-790. doi: 10.2147/CEOR.S178934. eCollection 2018.","Galve-Calvo E","Clinicoecon Outcomes Res","2018","2018/12/12","PMC6241542","","10.2147/CEOR.S178934"
"30489166","An indirect treatment comparison of the efficacy of patisiran and tafamidis for the treatment of hereditary transthyretin-mediated amyloidosis with polyneuropathy","Planté-Bordeneuve V, Lin H, Gollob J, Agarwal S, Betts M, Fahrbach K, Chitnis M, Polydefkis M.","Expert Opin Pharmacother. 2019 Mar;20(4):473-481. doi: 10.1080/14656566.2018.1554648. Epub 2018 Dec 12.","Planté-Bordeneuve V","Expert Opin Pharmacother","2019","2018/11/30","","","10.1080/14656566.2018.1554648"
"30474450","Budget impact analysis of secukinumab versus adalimumab in the treatment of ankylosing spondylitis","Purmonen T, Törmälehto S, Wahlman H, Puolakka K.","J Med Econ. 2019 Feb;22(2):151-157. doi: 10.1080/13696998.2018.1551227. Epub 2018 Dec 4.","Purmonen T","J Med Econ","2019","2018/11/27","","","10.1080/13696998.2018.1551227"
"30472749","Calcipotriol plus betamethasone dipropionate aerosol foam vs. apremilast, methotrexate, acitretin or fumaric acid esters for the treatment of plaque psoriasis: a matching-adjusted indirect comparison","Bewley AP, Shear NH, Calzavara-Pinton PG, Hansen JB, Nyeland ME, Signorovitch J.","J Eur Acad Dermatol Venereol. 2019 Jun;33(6):1107-1115. doi: 10.1111/jdv.15369. Epub 2019 Mar 19.","Bewley AP","J Eur Acad Dermatol Venereol","2019","2018/11/26","PMC6766948","","10.1111/jdv.15369"
"30465228","Dinutuximab Beta for Treating Neuroblastoma: An Evidence Review Group and Decision Support Unit Perspective of a NICE Single Technology Appraisal","Pennington B, Ren S, Barton S, Bacelar M, Edwards SJ.","Pharmacoeconomics. 2019 Aug;37(8):985-993. doi: 10.1007/s40273-018-0744-0.","Pennington B","Pharmacoeconomics","2019","2018/11/23","","","10.1007/s40273-018-0744-0"
"30464564","Cost-consequence model comparing eltrombopag and romiplostim in pediatric patients with chronic immune thrombocytopenia","Tremblay G, Dolph M, Bhor M, Said Q, Roy A, Elliott B, Briggs A.","Clinicoecon Outcomes Res. 2018 Nov 5;10:715-721. doi: 10.2147/CEOR.S177338. eCollection 2018.","Tremblay G","Clinicoecon Outcomes Res","2018","2018/11/23","PMC6223346","","10.2147/CEOR.S177338"
"30464563","Cost-consequence model comparing eltrombopag versus romiplostim for adult patients with chronic immune thrombocytopenia","Tremblay G, Dolph M, Bhor M, Said Q, Elliott B, Briggs A.","Clinicoecon Outcomes Res. 2018 Nov 1;10:705-713. doi: 10.2147/CEOR.S177324. eCollection 2018.","Tremblay G","Clinicoecon Outcomes Res","2018","2018/11/23","PMC6219311","","10.2147/CEOR.S177324"
"30429149","Effect of beta-blocker therapy on clinical outcomes, safety, health-related quality of life and functional capacity in patients with chronic obstructive pulmonary disease (COPD): a protocol for a systematic literature review and meta-analysis with multiple treatment comparison","Gulea C, Zakeri R, Quint JK.","BMJ Open. 2018 Nov 13;8(11):e024736. doi: 10.1136/bmjopen-2018-024736.","Gulea C","BMJ Open","2018","2018/11/16","PMC6252680","","10.1136/bmjopen-2018-024736"
"30426462","Autologous Chondrocyte Implantation with Chondrosphere for Treating Articular Cartilage Defects in the Knee: An Evidence Review Group Perspective of a NICE Single Technology Appraisal","Armoiry X, Cummins E, Connock M, Metcalfe A, Royle P, Johnston R, Rodrigues J, Waugh N, Mistry H.","Pharmacoeconomics. 2019 Jul;37(7):879-886. doi: 10.1007/s40273-018-0737-z.","Armoiry X","Pharmacoeconomics","2019","2018/11/15","","","10.1007/s40273-018-0737-z"
"30401604","Second-line cabozantinib versus nivolumab in advanced renal cell carcinoma: Systematic review and indirect treatment comparison","Porta C, Szczylik C, Casciano R, Fu S, Amzal B, Lister J, Karcher H, Meng J, Neumann M, Dinet J.","Crit Rev Oncol Hematol. 2019 Jul;139:143-148. doi: 10.1016/j.critrevonc.2018.10.004. Epub 2018 Oct 24.","Porta C","Crit Rev Oncol Hematol","2019","2018/11/08","","","10.1016/j.critrevonc.2018.10.004"
"30388073","Comparative effectiveness of secukinumab and adalimumab in ankylosing spondylitis as assessed by matching-adjusted indirect comparison","Maksymowych WP, Strand V, Nash P, Yazici Y, Thom H, Hunger M, Kalyvas C, Gandhi KK, Porter B, Jugl SM.","Eur J Rheumatol. 2018 Dec;5(4):216-223. doi: 10.5152/eurjrheum.2018.18162. Epub 2018 Oct 30.","Maksymowych WP","Eur J Rheumatol","2018","2018/11/03","PMC6267743","","10.5152/eurjrheum.2018.18162"
"30362839","Comparative efficacy of first-line ceritinib and crizotinib in advanced or metastatic anaplastic lymphoma kinase-positive non-small cell lung cancer: an adjusted indirect comparison with external controls","Li J, Knoll S, Bocharova I, Tang W, Signorovitch J.","Curr Med Res Opin. 2019 Jan;35(1):105-111. doi: 10.1080/03007995.2018.1541443. Epub 2018 Nov 15.","Li J","Curr Med Res Opin","2019","2018/10/27","","","10.1080/03007995.2018.1541443"
"30349228","Comparative efficacy of inhaled medications (ICS/LABA, LAMA, LAMA/LABA and SAMA) for COPD: a systematic review and network meta-analysis","Aziz MIA, Tan LE, Wu DB, Pearce F, Chua GSW, Lin L, Tan PT, Ng K.","Int J Chron Obstruct Pulmon Dis. 2018 Oct 9;13:3203-3231. doi: 10.2147/COPD.S173472. eCollection 2018.","Aziz MIA","Int J Chron Obstruct Pulmon Dis","2018","2018/10/24","PMC6186767","","10.2147/COPD.S173472"
"30314617","Focused Ultrasound Thalamotomy and Other Interventions for Medication-Refractory Essential Tremor: An Indirect Comparison of Short-Term Impact on Health-Related Quality of Life","Langford BE, Ridley CJA, Beale RC, Caseby SCL, Marsh WJ, Richard L.","Value Health. 2018 Oct;21(10):1168-1175. doi: 10.1016/j.jval.2018.03.015. Epub 2018 Jun 28.","Langford BE","Value Health","2018","2018/10/14","","","10.1016/j.jval.2018.03.015"
"30312378","Comparison of Methods to Generalize Randomized Clinical Trial Results Without Individual-Level Data for the Target Population","Hong JL, Webster-Clark M, Jonsson Funk M, Stürmer T, Dempster SE, Cole SR, Herr I, LoCasale R.","Am J Epidemiol. 2019 Feb 1;188(2):426-437. doi: 10.1093/aje/kwy233.","Hong JL","Am J Epidemiol","2019","2018/10/13","PMC6357813","","10.1093/aje/kwy233"
"30309978","Matching-adjusted indirect comparison of benralizumab versus interleukin-5 inhibitors for the treatment of severe asthma: a systematic review","Bourdin A, Husereau D, Molinari N, Golam S, Siddiqui MK, Lindner L, Xu X.","Eur Respir J. 2018 Nov 29;52(5):1801393. doi: 10.1183/13993003.01393-2018. Print 2018 Nov.","Bourdin A","Eur Respir J","2018","2018/10/13","PMC6277255","","10.1183/13993003.01393-2018"
"30304407","Long-term Survival and Value of Chimeric Antigen Receptor T-Cell Therapy for Pediatric Patients With Relapsed or Refractory Leukemia","Whittington MD, McQueen RB, Ollendorf DA, Kumar VM, Chapman RH, Tice JA, Pearson SD, Campbell JD.","JAMA Pediatr. 2018 Dec 1;172(12):1161-1168. doi: 10.1001/jamapediatrics.2018.2530.","Whittington MD","JAMA Pediatr","2018","2018/10/11","PMC6583018","","10.1001/jamapediatrics.2018.2530"
"30303022","Cost-effectiveness of pembrolizumab versus brentuximab vedotin for patients with relapsed or refractory classical Hodgkin's lymphoma: a United States payer perspective","Large S, Hettle R, Balakumaran A, Wu E, Borse RH.","J Med Econ. 2018 Nov 13:1-10. doi: 10.1080/13696998.2018.1534738. Online ahead of print.","Large S","J Med Econ","2018","2018/10/11","","","10.1080/13696998.2018.1534738"
"30298279","Ceritinib for Untreated Anaplastic Lymphoma Kinase-Positive Advanced Non-Small-Cell Lung Cancer: An Evidence Review Group Evaluation of a NICE Single Technology Appraisal","Claxton L, O'Connor J, Woolacott N, Wright K, Hodgson R.","Pharmacoeconomics. 2019 May;37(5):645-654. doi: 10.1007/s40273-018-0720-8.","Claxton L","Pharmacoeconomics","2019","2018/10/10","","","10.1007/s40273-018-0720-8"
"30293207","Nivolumab for Treating Metastatic or Unresectable Urothelial Cancer: An Evidence Review Group Perspective of a NICE Single Technology Appraisal","Grimm SE, Armstrong N, Ramaekers BLT, Pouwels X, Lang S, Petersohn S, Riemsma R, Worthy G, Stirk L, Ross J, Kleijnen J, Joore MA.","Pharmacoeconomics. 2019 May;37(5):655-667. doi: 10.1007/s40273-018-0723-5.","Grimm SE","Pharmacoeconomics","2019","2018/10/08","","","10.1007/s40273-018-0723-5"
"30286627","Comparative efficacy of brigatinib versus ceritinib and alectinib in patients with crizotinib-refractory anaplastic lymphoma kinase-positive non-small cell lung cancer","Reckamp K, Lin HM, Huang J, Proskorovsky I, Reichmann W, Krotneva S, Kerstein D, Huang H, Lee J.","Curr Med Res Opin. 2019 Apr;35(4):569-576. doi: 10.1080/03007995.2018.1520696. Epub 2018 Oct 5.","Reckamp K","Curr Med Res Opin","2019","2018/10/06","","","10.1080/03007995.2018.1520696"
"30277463","Paclitaxel density and clinical efficacy of drug-coated balloon angioplasty for femoropopliteal artery disease: meta-analysis and adjusted indirect comparison of 20 randomised trials","Cassese S, Ndrepepa G, Fusaro M, Kufner S, Xhepa E, Fusaro M.","EuroIntervention. 2019 Aug 9;15(6):e560-e562. doi: 10.4244/EIJ-D-18-00550.","Cassese S","EuroIntervention","2019","2018/10/03","","","10.4244/EIJ-D-18-00550"
"30942989","Pharmacoeconomic Review Report: Ozenoxacin 1% Cream (Ozanex): (Ferrer Internacional, S.A.): Indication: The topical treatment of impetigo in patients aged two months and older","","Ottawa (ON): Canadian Agency for Drugs and Technologies in Health; 2018 Oct.","","Pharmacoeconomic Review Report: Ozenoxacin 1% Cream (Ozanex): (Ferrer Internacional, S.A.): Indication: The topical treatment of impetigo in patients aged two months and older","2018","2018/10/01","","",""
"30227896","A systematic review and network meta-analysis comparing azacitidine and decitabine for the treatment of myelodysplastic syndrome","Almasri J, Alkhateeb HB, Firwana B, Sonbol MB, Damlaj M, Wang Z, Murad MH, Al-Kali A.","Syst Rev. 2018 Sep 19;7(1):144. doi: 10.1186/s13643-018-0805-7.","Almasri J","Syst Rev","2018","2018/09/20","PMC6145118","","10.1186/s13643-018-0805-7"
"30209002","Everolimus, lutetium-177 DOTATATE and sunitinib for advanced, unresectable or metastatic neuroendocrine tumours with disease progression: a systematic review and cost-effectiveness analysis","Mujica-Mota R, Varley-Campbell J, Tikhonova I, Cooper C, Griffin E, Haasova M, Peters J, Lucherini S, Talens-Bou J, Long L, Sherriff D, Napier M, Ramage J, Hoyle M.","Health Technol Assess. 2018 Sep;22(49):1-326. doi: 10.3310/hta22490.","Mujica-Mota R","Health Technol Assess","2018","2018/09/14","PMC6151360","","10.3310/hta22490"
"30205189","Anti-IL-5 treatments in patients with severe asthma by blood eosinophil thresholds: Indirect treatment comparison","Busse W, Chupp G, Nagase H, Albers FC, Doyle S, Shen Q, Bratton DJ, Gunsoy NB.","J Allergy Clin Immunol. 2019 Jan;143(1):190-200.e20. doi: 10.1016/j.jaci.2018.08.031. Epub 2018 Sep 8.","Busse W","J Allergy Clin Immunol","2019","2018/09/12","","","10.1016/j.jaci.2018.08.031"
"30188231","Cost-effectiveness of pembrolizumab in combination with chemotherapy in the 1st line treatment of non-squamous NSCLC in the US","Insinga RP, Vanness DJ, Feliciano JL, Vandormael K, Traore S, Burke T.","J Med Econ. 2018 Dec;21(12):1191-1205. doi: 10.1080/13696998.2018.1521416. Epub 2018 Sep 21.","Insinga RP","J Med Econ","2018","2018/09/07","","","10.1080/13696998.2018.1521416"
"30168349","Relative effectiveness of sunitinib versus everolimus in advanced pancreatic neuroendocrine tumors: an updated matching-adjusted indirect comparison","Ishak KJ, Rael M, Hicks M, Mittal S, Eatock M, Valle JW.","J Comp Eff Res. 2018 Oct;7(10):947-958. doi: 10.2217/cer-2018-0020. Epub 2018 Aug 31.","Ishak KJ","J Comp Eff Res","2018","2018/09/01","","","10.2217/cer-2018-0020"
"30101613","Azithromycin or erythromycin? Macrolides for non-cystic fibrosis bronchiectasis in adults: A systematic review and adjusted indirect treatment comparison","Li W, Qin Z, Gao J, Jiang Z, Chai Y, Guan L, Chen Y.","Chron Respir Dis. 2019 Jan-Dec;16:1479972318790269. doi: 10.1177/1479972318790269. Epub 2018 Aug 12.","Li W","Chron Respir Dis","2019","2018/08/14","PMC6302979","","10.1177/1479972318790269"
"30096625","Randomized controlled trials of antiepileptic drugs for the treatment of post-stroke seizures: A systematic review with network meta-analysis","Brigo F, Lattanzi S, Zelano J, Bragazzi NL, Belcastro V, Nardone R, Trinka E.","Seizure. 2018 Oct;61:57-62. doi: 10.1016/j.seizure.2018.08.001. Epub 2018 Aug 3.","Brigo F","Seizure","2018","2018/08/11","","","10.1016/j.seizure.2018.08.001"
"30086654","Benefits and risks of ponatinib versus bosutinib following treatment failure of two prior tyrosine kinase inhibitors in patients with chronic phase chronic myeloid leukemia: a matching-adjusted indirect comparison","Levy MY, McGarry LJ, Huang H, Lustgarten S, Chiroli S, Iannazzo S.","Curr Med Res Opin. 2019 Mar;35(3):479-487. doi: 10.1080/03007995.2018.1510225. Epub 2018 Aug 24.","Levy MY","Curr Med Res Opin","2019","2018/08/09","","","10.1080/03007995.2018.1510225"
"30052894","Real-world vs. randomized trial outcomes in similar populations of rivaroxaban-treated patients with non-valvular atrial fibrillation in ROCKET AF and XANTUS","Camm AJ, Amarenco P, Haas S, Hess S, Kirchhof P, Lambelet M, Bach M, Turpie AGG.","Europace. 2019 Mar 1;21(3):421-427. doi: 10.1093/europace/euy160.","Camm AJ","Europace","2019","2018/07/28","","","10.1093/europace/euy160"
"30030817","Pembrolizumab for Previously Treated Advanced or Metastatic Urothelial Cancer: An Evidence Review Group Perspective of a NICE Single Technology Appraisal","Gallacher D, Armoiry X, Auguste P, Court R, Mantopoulos T, Patterson J, De Santis M, Cresswell J, Mistry H.","Pharmacoeconomics. 2019 Jan;37(1):19-27. doi: 10.1007/s40273-018-0689-3.","Gallacher D","Pharmacoeconomics","2019","2018/07/22","","","10.1007/s40273-018-0689-3"
"29961001","History and publication trends in the diffusion and early uptake of indirect comparison meta-analytic methods to study drugs: animated coauthorship networks over time","Ban JK, Tadrous M, Lu AX, Cicinelli EA, Cadarette SM.","BMJ Open. 2018 Jun 30;8(6):e019110. doi: 10.1136/bmjopen-2017-019110.","Ban JK","BMJ Open","2018","2018/07/02","PMC6045745","","10.1136/bmjopen-2017-019110"
"29954828","Comparative effectiveness of treatment options for plantar heel pain: a systematic review with network meta-analysis","Babatunde OO, Legha A, Littlewood C, Chesterton LS, Thomas MJ, Menz HB, van der Windt D, Roddy E.","Br J Sports Med. 2019 Feb;53(3):182-194. doi: 10.1136/bjsports-2017-098998. Epub 2018 Jun 28.","Babatunde OO","Br J Sports Med","2019","2018/06/30","","","10.1136/bjsports-2017-098998"
"29954322","The use of single armed observational data to closing the gap in otherwise disconnected evidence networks: a network meta-analysis in multiple myeloma","Schmitz S, Maguire Á, Morris J, Ruggeri K, Haller E, Kuhn I, Leahy J, Homer N, Khan A, Bowden J, Buchanan V, O'Dwyer M, Cook G, Walsh C.","BMC Med Res Methodol. 2018 Jun 28;18(1):66. doi: 10.1186/s12874-018-0509-7.","Schmitz S","BMC Med Res Methodol","2018","2018/06/30","PMC6022299","","10.1186/s12874-018-0509-7"
"29949047","Comparative Efficacy of Treatments for Previously Treated Advanced or Metastatic Non-Small-Cell Lung Cancer: A Network Meta-Analysis","Li J, Sasane M, Zhao J, Horton VG, Zhang P, Ricculli ML, Zhou ZY, Signorovitch J.","Adv Ther. 2018 Jul;35(7):1035-1048. doi: 10.1007/s12325-018-0734-9. Epub 2018 Jun 15.","Li J","Adv Ther","2018","2018/06/28","","","10.1007/s12325-018-0734-9"
"29949014","Cardiovascular Safety of Empagliflozin Versus Dipeptidyl Peptidase-4 (DPP-4) Inhibitors in Type 2 Diabetes: Systematic Literature Review and Indirect Comparisons","Balijepalli C, Shirali R, Kandaswamy P, Ustyugova A, Pfarr E, Lund SS, Druyts E.","Diabetes Ther. 2018 Aug;9(4):1491-1500. doi: 10.1007/s13300-018-0456-7. Epub 2018 Jun 12.","Balijepalli C","Diabetes Ther","2018","2018/06/28","PMC6064600","","10.1007/s13300-018-0456-7"
"29861642","Matching-adjusted indirect treatment comparison of ribociclib and palbociclib in HR+, HER2- advanced breast cancer","Tremblay G, Chandiwana D, Dolph M, Hearnden J, Forsythe A, Monaco M.","Cancer Manag Res. 2018 May 22;10:1319-1327. doi: 10.2147/CMAR.S163478. eCollection 2018.","Tremblay G","Cancer Manag Res","2018","2018/06/05","PMC5968783","","10.2147/CMAR.S163478"
"29858770","Correction to: Secukinumab Versus Adalimumab for Psoriatic Arthritis: Comparative Effectiveness up to 48 Weeks Using a Matching-Adjusted Indirect Comparison","Nash P, McInnes IB, Mease PJ, Thom H, Hunger M, Karabis A, Gandhi K, Mpofu S, Jugl SM.","Rheumatol Ther. 2018 Dec;5(2):595. doi: 10.1007/s40744-018-0117-3.","Nash P","Rheumatol Ther","2018","2018/06/03","PMC6251848","","10.1007/s40744-018-0117-3"
"29788164","What is the optimal systemic treatment of men with metastatic, hormone-naive prostate cancer? A STOPCAP systematic review and network meta-analysis","Vale CL, Fisher DJ, White IR, Carpenter JR, Burdett S, Clarke NW, Fizazi K, Gravis G, James ND, Mason MD, Parmar MKB, Rydzewska LH, Sweeney CJ, Spears MR, Sydes MR, Tierney JF.","Ann Oncol. 2018 May 1;29(5):1249-1257. doi: 10.1093/annonc/mdy071.","Vale CL","Ann Oncol","2018","2018/05/23","PMC5961275","","10.1093/annonc/mdy071"
"29785685","Network meta-analysis: an introduction for pharmacists","Xu Y, Amiche MA, Tadrous M.","Int J Clin Pharm. 2018 Oct;40(5):942-947. doi: 10.1007/s11096-018-0656-2.","Xu Y","Int J Clin Pharm","2018","2018/05/23","","","10.1007/s11096-018-0656-2"
"29764245","Pembrolizumab versus the standard of care for relapsed and refractory classical Hodgkin's lymphoma progressing after brentuximab vedotin: an indirect treatment comparison","Keeping S, Wu E, Chan K, Mojebi A, Ferrante SA, Balakumaran A.","Expert Rev Hematol. 2018 Jun;11(6):503-511. doi: 10.1080/17474086.2018.1475226. Epub 2018 May 23.","Keeping S","Expert Rev Hematol","2018","2018/05/17","","","10.1080/17474086.2018.1475226"
"29753347","Economic Modeling Considerations for Rare Diseases","Pearson I, Rothwell B, Olaye A, Knight C.","Value Health. 2018 May;21(5):515-524. doi: 10.1016/j.jval.2018.02.008. Epub 2018 Apr 17.","Pearson I","Value Health","2018","2018/05/14","","","10.1016/j.jval.2018.02.008"
"31646068","Alternative metrics for assessing clinical benefit with immunotherapy in oncology","Chan E, Quinn C, Hirji I, Hillengass J, Anderson K, Oukessou A, Davis C.","Oncoimmunology. 2018 May 7;8(10):e1343774. doi: 10.1080/2162402X.2017.1343774. eCollection 2019.","Chan E","Oncoimmunology","2018","2019/10/25","PMC6791423","","10.1080/2162402X.2017.1343774"
"29692179","An indirect comparison of intravenous and subcutaneous belimumab efficacy in patients with SLE and high disease activity","Ramachandran S, Parks D, Kurtinecz M, Roth DA, Alfonso-Cristancho R.","J Comp Eff Res. 2018 Jun;7(6):581-593. doi: 10.2217/cer-2017-0085. Epub 2018 Apr 25.","Ramachandran S","J Comp Eff Res","2018","2018/04/26","","","10.2217/cer-2017-0085"
"29674504","Efficacy of bendamustine and rituximab as first salvage treatment in chronic lymphocytic leukemia and indirect comparison with ibrutinib: a GIMEMA, ERIC and UK CLL FORUM study","Cuneo A, Follows G, Rigolin GM, Piciocchi A, Tedeschi A, Trentin L, Perez AM, Coscia M, Laurenti L, Musuraca G, Farina L, Delgado AR, Orlandi EM, Galieni P, Mauro FR, Visco C, Amendola A, Billio A, Marasca R, Chiarenza A, Meneghini V, Ilariucci F, Marchetti M, Molica S, Re F, Gaidano G, Gonzalez M, Forconi F, Ciolli S, Cortelezzi A, Montillo M, Smolej L, Schuh A, Eyre TA, Kennedy B, Bowles KM, Vignetti M, de la Serna J, Moreno C, Foà R, Ghia P; GIMEMA, European Research Initiative on CLL (ERIC) and UK CLL forum.","Haematologica. 2018 Jul;103(7):1209-1217. doi: 10.3324/haematol.2018.189837. Epub 2018 Apr 19.","Cuneo A","Haematologica","2018","2018/04/21","PMC6029555","","10.3324/haematol.2018.189837"
"29645352","Efficacy and safety of prostate artery embolization for benign prostatic hyperplasia: an observational study and propensity-matched comparison with transurethral resection of the prostate (the UK-ROPE study)","Ray AF, Powell J, Speakman MJ, Longford NT, DasGupta R, Bryant T, Modi S, Dyer J, Harris M, Carolan-Rees G, Hacking N.","BJU Int. 2018 Aug;122(2):270-282. doi: 10.1111/bju.14249. Epub 2018 May 6.","Ray AF","BJU Int","2018","2018/04/13","","","10.1111/bju.14249"
"29641566","Indirect treatment comparison of cabazitaxel for patients with metastatic castrate-resistant prostate cancer who have been previously treated with a docetaxel-containing regimen","Fryzek JP, Reichert H, Summers N, Townes L, Deuson R, Alexander DD, Vanderpuye-Orgle J.","PLoS One. 2018 Apr 11;13(4):e0195790. doi: 10.1371/journal.pone.0195790. eCollection 2018.","Fryzek JP","PLoS One","2018","2018/04/12","PMC5895064","","10.1371/journal.pone.0195790"
"29630885","Vaginal progesterone is as effective as cervical cerclage to prevent preterm birth in women with a singleton gestation, previous spontaneous preterm birth, and a short cervix: updated indirect comparison meta-analysis","Conde-Agudelo A, Romero R, Da Fonseca E, O'Brien JM, Cetingoz E, Creasy GW, Hassan SS, Erez O, Pacora P, Nicolaides KH.","Am J Obstet Gynecol. 2018 Jul;219(1):10-25. doi: 10.1016/j.ajog.2018.03.028. Epub 2018 Apr 7.","Conde-Agudelo A","Am J Obstet Gynecol","2018","2018/04/10","PMC6449041","NIHMS958160","10.1016/j.ajog.2018.03.028"
"29627809","Antithrombotic therapy in patients receiving saphenous vein coronary artery bypass grafts: a protocol for a systematic review and network meta-analysis","Solo K, Martin J, Lavi S, Kabali C, John-Baptiste A, Nevis IF, Choudhury T, Mamas MA, Bagur R.","BMJ Open. 2018 Apr 7;8(4):e019555. doi: 10.1136/bmjopen-2017-019555.","Solo K","BMJ Open","2018","2018/04/09","PMC5892747","","10.1136/bmjopen-2017-019555"
