,29/06/2022 14:20:27,1,10.2147/JBM.S312885,BZ,Hemophilia B,Sweden,Germany,"Academic, Pharmaceutical Industry, Private Data Analysis Company",Yes,Pharmaceutical Industry,Yes,No,1,Yes,Yes,NCT01027364,,,International,3,2 or more,2,No,Yes,NCT01496274,,,International,"2, 3",2 or more,,,,,,,,,,,,,,,,,,,,,,,,,,,,rFIXFc (regimen prior to study entry : prior prophylaxis),1,rIX-FP,2,MAIC,No,Simple (ie treatments effects extracted from two studies),Yes,Annualized bleeding rate (ABR),"Continuous (count, mean, ...)","Nothing mentioned, not reported",No discussion (in the main text) of the status of prognostic factors of the variables,No discussion (in the main text) of the status of treatment-effect modifiers of the variables,No,No,40,,45,26,,,Not mentioned,Yes,4,"Age, Disease severity/disease history (ie past conditions or symptoms directly related to the disease of interest, eg history of venous thromboembolism in sickle cell disease), Race/ethnicity, Other(s)",Incidence Rate Ratio,"Numerator if ratio, or left side if difference",,,1.18,[0.67;2.10],Treatment regimen prior to study entry : prior prophylaxis,28/06/2022 17:32:01
,29/06/2022 14:25:30,2,10.2147/JBM.S312885,BZ,,,,,,,,,,,,,,,,,,,,,,,,,,,,,,,,,,,,,,,,,,,,,,,,,,,,,,rFIXFc (treatment regimen prior to study entry : prior on-demand treatment),1,rIX-FP,2,,No,Simple (ie treatments effects extracted from two studies),Yes,Annualized bleeding rate (ABR),"Continuous (count, mean, ...)","Nothing mentioned, not reported",No discussion (in the main text) of the status of prognostic factors of the variables,No discussion (in the main text) of the status of treatment-effect modifiers of the variables,No,No,19,,42,10,,,Not mentioned,Yes,4,"Age, Disease severity/disease history (ie past conditions or symptoms directly related to the disease of interest, eg history of venous thromboembolism in sickle cell disease), Race/ethnicity, Other(s)",Incidence Rate Ratio,"Numerator if ratio, or left side if difference",,,1.01,[0.40;2.57],Treatment regimen prior to study entry : prior on-demand treatment,29/06/2022 14:20:27
,28/07/2022 17:09:08,1,10.1002/edm2.259,BZ,type 2 diabetes (cardiovascular outcomes),UK,"Danemark, Sweden","Academic, Private Data Analysis Company",Yes,Pharmaceutical Industry,Yes,Yes,1,Yes,Yes,NCT01720446,,,International,3,2 or more,2,Yes,Yes,NCT01394952,,,International,3,2 or more,,,,,,,,,,,,,,,,,,,,,,,,,,,,Semaglutide 0.5 and 1 mg,1,Dulaglutide 1.5 mg,2,MAIC,Yes,Simple (ie treatments effects extracted from two studies),Yes,"Three‐point (3P) MACE (Major adverse cardiovascular events : CV death, non‐fatal myocardial infarction, non‐fatal stroke)",Time-to-event,A priori expert-knowledge (clinically or methodologically relevant to adjust on these variables based on experts/clinicians opinion),No,Yes,Yes,No,4949,4952,1648,NA,1649,NA,"Yes, mentions that the weights distribution has been studied, and weights distribution reported in main article or supplemental materials",Yes,6,"Disease severity/disease history (ie past conditions or symptoms directly related to the disease of interest, eg history of venous thromboembolism in sickle cell disease), Comorbidities and medical history (beside pathology/disease of interest in the comparison)",HR,"Numerator if ratio, or left side if difference",,,0.74,0.06,ESS Semaglutide + Placebo  = 2633,29/06/2022 14:25:30
,29/06/2022 16:16:20,1,10.1080/03007995.2021.1953456,BZ,Relapsed or refractory multiple myeloma,USA,Canada,"Academic, Pharmaceutical Industry, Private Data Analysis Company",Yes,Pharmaceutical Industry,Yes,No,1,Yes,Yes,NCT03548207,,,International,"1, 2",1,2,No,Yes,NCT03361748,,,International,2,1,,,,,,,,,,,,,,,,,,,,,,,,,,,,ciltacabtagene autoleucel,1,idecabtagene vicleucel,2,MAIC,No,Simple (ie treatments effects extracted from two studies),"No primary outcome defined, or multiple primary outcomes without any clear distinction between them",Overall Response Rate,Binary (eg rates),"A priori expert-knowledge (clinically or methodologically relevant to adjust on these variables based on experts/clinicians opinion), Literature based (clinically or methodologically relevant to adjust on these variables based on the literature search conducted for this specific purpose)",Yes,No discussion (in the main text) of the status of treatment-effect modifiers of the variables,No,No,124,,96,52,,,"Yes, mentions that the weights distribution has been studied, and weights distribution reported in main article or supplemental materials",Yes,4,"Disease severity/disease history (ie past conditions or symptoms directly related to the disease of interest, eg history of venous thromboembolism in sickle cell disease), Performance score",OR,"Numerator if ratio, or left side if difference",16.52,0.0002,94.93,<0.0001,,29/06/2022 15:37:57
,29/06/2022 17:48:09,1,10.1080/03007995.2021.1947216,BZ,spinal muscular atrophy type 1,Switzeland,USA,"Pharmaceutical Industry, Private Data Analysis Company",Yes,Pharmaceutical Industry,Yes,Yes,1,Yes,Yes, NCT02122952,,,USA,1,2 or more,2,Yes,Yes, NCT02122952,,,USA,3,1,3,No,Yes,nusinerse,,,International,3,1,,,,,,,,,,,,,,,,,,,onasemnogene abeparvovec,1;2,Nusinersen,3,MAIC,No,"Aggregation of multiple studies to estimate individual treatment effects (e.g. meta-analysis in a first step to estimate treatment A effect, then population adjusted indirect comparison using treatment A effect estimate)","No primary outcome defined, or multiple primary outcomes without any clear distinction between them",Event-free survival,Time-to-event,"Statistical based (ie pvalue based, that is looking at statistical significant differences between treatment arms), A priori expert-knowledge (clinically or methodologically relevant to adjust on these variables based on experts/clinicians opinion)",Yes,Yes,Yes,No,81,,34,"24,6",,,Not mentioned,Yes,2,"Disease severity/disease history (ie past conditions or symptoms directly related to the disease of interest, eg history of venous thromboembolism in sickle cell disease), Performance score",HR,"Numerator if ratio, or left side if difference",,,"0,19",[0.07;0.54],,29/06/2022 16:16:20
,30/06/2022 15:11:01,1,10.3390/cancers13102406,BZ,Hepatocellular Carcinoma,Italy,Italy,Academic,Not mentioned,This research received no external funding.,None,No,1,Yes,No,,,"Patients affected by HCC who underwent surgical at the Hepatobiliary Surgery and Liver Transplantation Unit, University of Padua.",Italy,,,2,No,Yes,NCT01387503,,,Italy,,2 or more,,,,,,,,,,,,,,,,,,,,,,,,,,,,Padua downstaging protocol ,1,XXL trial downstaging protocol ,2,MAIC,No,Simple (ie treatments effects extracted from two studies),Yes,Downstaging failures ,Binary (eg rates),"Nothing mentioned, not reported",No discussion (in the main text) of the status of prognostic factors of the variables,No discussion (in the main text) of the status of treatment-effect modifiers of the variables,No,No,74,,191,NA,,,Not mentioned,No,,,NA,,,,,,"Les auteurs n'ont pas calculé de ""mesure statistique"" du ""downstaging failure"" :
Proportion de ""downstaging failure"" dans leur cohorte ajustée : 12%
Proportion de ""downstaging failure"" dans l'essai XXL  : 32%
effect size (d value) = |0.683|",29/06/2022 17:48:09
,30/06/2022 15:52:24,1,10.3390/biom11060780,BZ,Metastatic Pancreatic Cancer,Itally,Italy,Academic,Not mentioned,This research received no external funding.,None,No,1,Yes,No,,,A real-world setting :  patients’ electronic records.,Italy,,,2,No,Yes,NCT00112658,,,France,"2, 3",2 or more,,,,,,,,,,,,,,,,,,,,,,,,,,,,Gemcitabine + Nab-Paclitaxel ,1,FOLFIRINOX,2,MAIC,No,Simple (ie treatments effects extracted from two studies),"No primary outcome defined, or multiple primary outcomes without any clear distinction between them",Overall survival (OS),Time-to-event,"Nothing mentioned, not reported",No discussion (in the main text) of the status of prognostic factors of the variables,No discussion (in the main text) of the status of treatment-effect modifiers of the variables,No,No,171,,268,NA,,,Not mentioned,No,,,HR,"Denominator if ratio, or rightside if difference",,,1.1,0.527,,30/06/2022 15:11:01
,30/06/2022 17:27:23,2,10.1111/head.14128,BZ,migraine,Canada,USA,"Academic, Pharmaceutical Industry, Private Data Analysis Company",Yes,Pharmaceutical Industry,Yes,No,1,Yes,Yes,NCT03266588,,,USA,"2, 3",1,2,No,Yes,NCT02614183,,,International,3,2 or more,3,No,Yes,NCT02614196,,,International,3,2 or more,4,No,Yes,NCT02456740,,,International,3,2 or more,,,,,,,,,,rimegepant,1,galcanezumab,2;3,MAIC,No,"Aggregation of multiple studies to estimate individual treatment effects (e.g. meta-analysis in a first step to estimate treatment A effect, then population adjusted indirect comparison using treatment A effect estimate)","No primary outcome defined, or multiple primary outcomes without any clear distinction between them",Change in MIDAS (MIgraine Disability Assessment) from baseline to 12 weeks,"Categorical (more than 2 categories, ordered or not; eg scales)","Nothing mentioned, not reported",No discussion (in the main text) of the status of prognostic factors of the variables,No discussion (in the main text) of the status of treatment-effect modifiers of the variables,Yes,No,1773,,257,169,,,"Yes, mentions that the weights distribution has been studied, and weights distribution reported in main article or supplemental materials",Yes,6,"Age, Sex, Disease severity/disease history (ie past conditions or symptoms directly related to the disease of interest, eg history of venous thromboembolism in sickle cell disease), Race/ethnicity",Means difference,"Numerator if ratio, or left side if difference",1.75,0.528,-0.09,0.979,,30/06/2022 15:52:24
,30/06/2022 17:31:28,1,10.1111/head.14128,BZ,,,,,,,,,,,,,,,,,,,,,,,,,,,,,,,,,,,,,,,,,,,,,,,,,,,,,,rimegepant,1,Placebo,2;3,MAIC,No,"Aggregation of multiple studies to estimate individual treatment effects (e.g. meta-analysis in a first step to estimate treatment A effect, then population adjusted indirect comparison using treatment A effect estimate)","No primary outcome defined, or multiple primary outcomes without any clear distinction between them", Change in MIDAS (MIgraine Disability Assessment) from baseline to 12 weeks,"Categorical (more than 2 categories, ordered or not; eg scales)","Nothing mentioned, not reported",No discussion (in the main text) of the status of prognostic factors of the variables,No discussion (in the main text) of the status of treatment-effect modifiers of the variables,Yes,No,1773,,257,169,,,"Yes, mentions that the weights distribution has been studied, and weights distribution reported in main article or supplemental materials",Yes,6,"Age, Sex, Disease severity/disease history (ie past conditions or symptoms directly related to the disease of interest, eg history of venous thromboembolism in sickle cell disease), Race/ethnicity",Means difference,"Numerator if ratio, or left side if difference",-5.54,0.026,-7.37,0.009,,30/06/2022 17:27:23
,30/06/2022 17:35:39,4,10.1111/head.14128,BZ,,,,,,,,,,,,,,,,,,,,,,,,,,,,,,,,,,,,,,,,,,,,,,,,,,,,,,Rimegepant,1,Erenumab,4,MAIC,No,"Aggregation of multiple studies to estimate individual treatment effects (e.g. meta-analysis in a first step to estimate treatment A effect, then population adjusted indirect comparison using treatment A effect estimate)","No primary outcome defined, or multiple primary outcomes without any clear distinction between them", Change in MIDAS (MIgraine Disability Assessment) from baseline to 12 weeks,"Categorical (more than 2 categories, ordered or not; eg scales)","Nothing mentioned, not reported",No discussion (in the main text) of the status of prognostic factors of the variables,No discussion (in the main text) of the status of treatment-effect modifiers of the variables,Yes,No,955,,257,214,,,"Yes, mentions that the weights distribution has been studied, and weights distribution reported in main article or supplemental materials",Yes,6,"Age, Sex, Disease severity/disease history (ie past conditions or symptoms directly related to the disease of interest, eg history of venous thromboembolism in sickle cell disease), Race/ethnicity",Means difference,"Numerator if ratio, or left side if difference",3.48,0.172,1.75,0.501,,30/06/2022 17:31:28
,30/06/2022 17:38:30,3,10.1111/head.14128,BZ,,,,,,,,,,,,,,,,,,,,,,,,,,,,,,,,,,,,,,,,,,,,,,,,,,,,,,Rimegepant,1,Placebo,4,MAIC,No,Simple (ie treatments effects extracted from two studies),"No primary outcome defined, or multiple primary outcomes without any clear distinction between them", Change in MIDAS (MIgraine Disability Assessment) from baseline to 12 weeks,"Categorical (more than 2 categories, ordered or not; eg scales)","Nothing mentioned, not reported",No discussion (in the main text) of the status of prognostic factors of the variables,No discussion (in the main text) of the status of treatment-effect modifiers of the variables,Yes,No,955,,257,214,,,"Yes, mentions that the weights distribution has been studied, and weights distribution reported in main article or supplemental materials",,6,"Age, Sex, Disease severity/disease history (ie past conditions or symptoms directly related to the disease of interest, eg history of venous thromboembolism in sickle cell disease), Race/ethnicity",Means difference,"Numerator if ratio, or left side if difference",-3.94,0.121,-5.67,0.025,,30/06/2022 17:35:39
,28/07/2022 17:13:33,1,10.1007/s12325-021-01756-0,BZ,Relapsed/refractory Diffuse Large B-Cell Lymphoma,USA,Switzerland,"Academic, Private Data Analysis Company",Yes,Pharmaceutical Industry,Yes,Yes,1,Yes,Yes,NCT02631044,,,USA,1,1,2,No,No,,,SCHOLAR-1,International,,,,,,,,,,,,,,,,,,,,,,,,,,,,,,lisocabtagene maraleucel,1,Salvage Chemotherapy,2,MAIC,No,Simple (ie treatments effects extracted from two studies),"No primary outcome defined, or multiple primary outcomes without any clear distinction between them",Objective response rate (ORR),Binary (eg rates),"Nothing mentioned, not reported",Yes,Yes,No,No,636,,256,142,,,Not mentioned,Yes,7,"Age, Sex, Disease severity/disease history (ie past conditions or symptoms directly related to the disease of interest, eg history of venous thromboembolism in sickle cell disease), Past treatments for the disease of interest",OR,"Numerator if ratio, or left side if difference",7.7,< 0.001,7,< 0.001,"Unanchored MAICs have several limitations, particularly that they require adjustment for all clinically relevant prognostic factors and treatment effect modifiers",30/06/2022 17:38:30
,01/07/2022 16:10:44,1,10.1080/10428194.2021.1913144,BZ,Chronic lymphocytic leukemia,USA,UK,"Academic, Pharmaceutical Industry",Not mentioned,Pharmaceutical Industry,Yes,Yes,1,Yes,Yes,NCT02475681,,,International,3,2 or more,2,No,Yes,NCT01722487,,,International,3,2 or more,3,No,Yes,NCT02264574,,,International,3,2 or more,4,No,Yes,NCT02242942,,,International,3,2 or more,,,,,,,,,,Acalabrutinib + obinutuzumab,1,Ibrutinib,2,MAIC,No,Simple (ie treatments effects extracted from two studies),"No primary outcome defined, or multiple primary outcomes without any clear distinction between them",progression-free survival,Time-to-event,"Statistical based (ie pvalue based, that is looking at statistical significant differences between treatment arms), A priori expert-knowledge (clinically or methodologically relevant to adjust on these variables based on experts/clinicians opinion)",No discussion (in the main text) of the status of prognostic factors of the variables,No discussion (in the main text) of the status of treatment-effect modifiers of the variables,Yes,No,136,,126,59,,,"Yes, mentions that the weights distribution has been studied, but weights distribution not reported",Yes,12,"Age, Sex, Disease severity/disease history (ie past conditions or symptoms directly related to the disease of interest, eg history of venous thromboembolism in sickle cell disease), Performance score, Comorbidities and medical history (beside pathology/disease of interest in the comparison)",HR,"Numerator if ratio, or left side if difference",,,0.61,0.3,,01/07/2022 12:29:49
,01/07/2022 16:14:19,2,10.1080/10428194.2021.1913144,BZ,,,,,,,,,,,,,,,,,,,,,,,,,,,,,,,,,,,,,,,,,,,,,,,,,,,,,,Acalabrutinib,1,Ibrutinib,2,MAIC,No,Simple (ie treatments effects extracted from two studies),"No primary outcome defined, or multiple primary outcomes without any clear distinction between them",progression-free survival,Time-to-event,"Statistical based (ie pvalue based, that is looking at statistical significant differences between treatment arms), A priori expert-knowledge (clinically or methodologically relevant to adjust on these variables based on experts/clinicians opinion)",No discussion (in the main text) of the status of prognostic factors of the variables,No discussion (in the main text) of the status of treatment-effect modifiers of the variables,Yes,No,136,,136,79,,,"Yes, mentions that the weights distribution has been studied, but weights distribution not reported",Yes,12,"Age, Sex, Disease severity/disease history (ie past conditions or symptoms directly related to the disease of interest, eg history of venous thromboembolism in sickle cell disease), Performance score, Comorbidities and medical history (beside pathology/disease of interest in the comparison)",RR,"Numerator if ratio, or left side if difference",,,0.92,0.83,,01/07/2022 16:10:44
,01/07/2022 16:16:38,3,10.1080/10428194.2021.1913144,BZ,,,,,,,,,,,,,,,,,,,,,,,,,,,,,,,,,,,,,,,,,,,,,,,,,,,,,,Acalabrutinib + obinutuzumab,1,Ibrutinib + obinutuzumab,3,MAIC,No,Simple (ie treatments effects extracted from two studies),"No primary outcome defined, or multiple primary outcomes without any clear distinction between them",progression-free survival,Time-to-event,"Statistical based (ie pvalue based, that is looking at statistical significant differences between treatment arms), A priori expert-knowledge (clinically or methodologically relevant to adjust on these variables based on experts/clinicians opinion)",No discussion (in the main text) of the status of prognostic factors of the variables,No discussion (in the main text) of the status of treatment-effect modifiers of the variables,Yes,No,113,,113,97,,,"Yes, mentions that the weights distribution has been studied, but weights distribution not reported",Yes,12,"Age, Sex, Disease severity/disease history (ie past conditions or symptoms directly related to the disease of interest, eg history of venous thromboembolism in sickle cell disease), Performance score, Comorbidities and medical history (beside pathology/disease of interest in the comparison)",HR,"Numerator if ratio, or left side if difference",,,0.55,0.11,,01/07/2022 16:14:19
,01/07/2022 16:19:01,4,10.1080/10428194.2021.1913144,BZ,,,,,,,,,,,,,,,,,,,,,,,,,,,,,,,,,,,,,,,,,,,,,,,,,,,,,,Acalabrutinib,1,Ibrutinib + obinutuzumab,3,MAIC,No,Simple (ie treatments effects extracted from two studies),"No primary outcome defined, or multiple primary outcomes without any clear distinction between them",progression-free survival,Time-to-event,"Statistical based (ie pvalue based, that is looking at statistical significant differences between treatment arms), A priori expert-knowledge (clinically or methodologically relevant to adjust on these variables based on experts/clinicians opinion)",No discussion (in the main text) of the status of prognostic factors of the variables,No discussion (in the main text) of the status of treatment-effect modifiers of the variables,Yes,No,113,,114,97,,,"Yes, mentions that the weights distribution has been studied, but weights distribution not reported",Yes,12,"Age, Sex, Disease severity/disease history (ie past conditions or symptoms directly related to the disease of interest, eg history of venous thromboembolism in sickle cell disease), Performance score, Comorbidities and medical history (beside pathology/disease of interest in the comparison)",HR,"Numerator if ratio, or left side if difference",,,0.53,0.08,,01/07/2022 16:16:38
,01/07/2022 16:24:18,5,10.1080/10428194.2021.1913144,BZ,,,,,,,,,,,,,,,,,,,,,,,,,,,,,,,,,,,,,,,,,,,,,,,,,,,,,,Acalabrutinib + obinutuzumab,1,Venetoclax + obinutuzumab,4,MAIC,No,Simple (ie treatments effects extracted from two studies),"No primary outcome defined, or multiple primary outcomes without any clear distinction between them",progression-free survival,Time-to-event,"Statistical based (ie pvalue based, that is looking at statistical significant differences between treatment arms), A priori expert-knowledge (clinically or methodologically relevant to adjust on these variables based on experts/clinicians opinion)",No discussion (in the main text) of the status of prognostic factors of the variables,No discussion (in the main text) of the status of treatment-effect modifiers of the variables,Yes,No,216,,83,43,,,"Yes, mentions that the weights distribution has been studied, but weights distribution not reported",Yes,12,"Age, Sex, Disease severity/disease history (ie past conditions or symptoms directly related to the disease of interest, eg history of venous thromboembolism in sickle cell disease), Performance score, Comorbidities and medical history (beside pathology/disease of interest in the comparison)",HR,"Numerator if ratio, or left side if difference",,,0.78,0.57,,01/07/2022 16:19:01
,01/07/2022 16:26:25,6,10.1080/10428194.2021.1913144,BZ,,,,,,,,,,,,,,,,,,,,,,,,,,,,,,,,,,,,,,,,,,,,,,,,,,,,,,Acalabrutinib,1,Venetoclax + obinutuzumab,4,MAIC,No,Simple (ie treatments effects extracted from two studies),"No primary outcome defined, or multiple primary outcomes without any clear distinction between them",progression-free survival,Time-to-event,"Statistical based (ie pvalue based, that is looking at statistical significant differences between treatment arms), A priori expert-knowledge (clinically or methodologically relevant to adjust on these variables based on experts/clinicians opinion)",No discussion (in the main text) of the status of prognostic factors of the variables,No discussion (in the main text) of the status of treatment-effect modifiers of the variables,Yes,No,216,,96,51,,,"Yes, mentions that the weights distribution has been studied, but weights distribution not reported",Yes,12,"Age, Sex, Disease severity/disease history (ie past conditions or symptoms directly related to the disease of interest, eg history of venous thromboembolism in sickle cell disease), Performance score, Comorbidities and medical history (beside pathology/disease of interest in the comparison)",HR,"Numerator if ratio, or left side if difference",,,1.24,0.59,,01/07/2022 16:24:18
,01/07/2022 17:05:08,1,10.1080/10428194.2021.1913143,BZ,Relapsed and refractory multiple myeloma,Spain,Switzerland,"Academic, Pharmaceutical Industry, Private Data Analysis Company",Yes,Pharmaceutical Industry,Yes,Yes,1,Yes,Yes,NCT03361748,,,International,2,1,2,No,Yes,NCT02336815,,,International,2,1,3,No,Yes,NCT03525678,,,International,2,1,,,,,,,,,,,,,,,,,,,idecabtagene vicleucel ,1,Selinexor + dexamethasone,2,MAIC,No,Simple (ie treatments effects extracted from two studies),"No primary outcome defined, or multiple primary outcomes without any clear distinction between them",Overall response rate,Binary (eg rates),"Statistical based (ie pvalue based, that is looking at statistical significant differences between treatment arms), A priori expert-knowledge (clinically or methodologically relevant to adjust on these variables based on experts/clinicians opinion), Literature based (clinically or methodologically relevant to adjust on these variables based on the literature search conducted for this specific purpose)",Yes,Yes,No,No,122,,128,56,,,Not mentioned,Yes,6,"Disease severity/disease history (ie past conditions or symptoms directly related to the disease of interest, eg history of venous thromboembolism in sickle cell disease), Past treatments for the disease of interest",OR,"Numerator if ratio, or left side if difference",7.78,[4.43;13.65],7.74,[3.83;15.62],"These include the fact that some prog-
nostic factors and/or effect modifiers may not have
been adjusted for in the analysis because they were
not reported.",01/07/2022 16:26:25
,01/07/2022 17:11:16,2,10.1080/10428194.2021.1913143,BZ,,,,,,,,,,,,,,,,,,,,,,,,,,,,,,,,,,,,,,,,,,,,,,,,,,,,,,Idecabtagene + vicleucel,1,Belantamab mafodotin,3,MAIC,No,Simple (ie treatments effects extracted from two studies),"No primary outcome defined, or multiple primary outcomes without any clear distinction between them",Overall response rate,Binary (eg rates),"Statistical based (ie pvalue based, that is looking at statistical significant differences between treatment arms), A priori expert-knowledge (clinically or methodologically relevant to adjust on these variables based on experts/clinicians opinion), Literature based (clinically or methodologically relevant to adjust on these variables based on the literature search conducted for this specific purpose)",Yes,Yes,No,No,97,,128,45,,,Not mentioned,Yes,6,"Disease severity/disease history (ie past conditions or symptoms directly related to the disease of interest, eg history of venous thromboembolism in sickle cell disease), Past treatments for the disease of interest",OR,"Numerator if ratio, or left side if difference",6.17,[3.45;11.05],5.12,[2.35;11.13],". These include the fact that some prog-
nostic factors and/or effect modifiers may not have
been adjusted for in the analysis because they were
not reported.",01/07/2022 17:05:08
